{
  "schema_version": "1.0",
  "feature_id": "F002",
  "build": "0.1.0+3f9c2ab (debug, headless)",
  "mode": "deterministic_script",
  "runs": 1,
  "seed": 1,
  "steps": [
    {
      "t": 0,
      "action": { "type": "start_level", "level_id": "w1_l001" },
      "expect": { "state": "battle", "pebbles": 30, "board.count": 0 },
      "observed": { "state": "battle", "pebbles": 30, "board.count": 0 },
      "ok": true
    },
    {
      "t": 0.6,
      "action": { "type": "spawn" },
      "expect": { "board.count": 1, "pebbles": 20 },
      "observed": { "board.count": 1, "pebbles": 20 },
      "ok": true
    },
    {
      "t": 1.2,
      "action": { "type": "spawn" },
      "expect": { "board.count": 2, "pebbles": 5 },
      "observed": { "board.count": 2, "pebbles": 5 },
      "ok": true
    },
    {
      "t": 2.0,
      "action": { "type": "merge", "from": [2, 3], "to": [1, 3] },
      "expect": { "board.count": 1, "board.max_tier": 2 },
      "observed": { "board.count": 1, "board.max_tier": 2 },
      "ok": true
    },
    {
      "t": 2.8,
      "action": { "type": "merge", "from": [1, 3], "to": [4, 0] },
      "expect": { "board.count": 1, "board.cell.1.3.tier": 2 },
      "observed": { "board.count": 1, "board.cell.1.3.tier": 2 },
      "ok": true
    },
    {
      "t": 9.5,
      "action": { "type": "wait_until", "condition": "wave_cleared", "wave": 1 },
      "expect": { "wave": 2, "hearts": 3, "pebbles": { "op": ">=", "value": 15 } },
      "observed": { "wave": 2, "hearts": 3, "pebbles": 23 },
      "ok": true
    },
    {
      "t": 176.4,
      "action": { "type": "wait_until", "condition": "level_end" },
      "expect": { "result": "win", "stars_earned": 1, "coins_earned": 40 },
      "observed": { "result": "win", "stars_earned": 1, "coins_earned": 40 },
      "ok": true
    }
  ],
  "metrics": {
    "win_rate": 1.0,
    "avg_session_sec": 176.4,
    "time_to_first_reward_sec": 4.2,
    "softlocks": 0,
    "crashes": 0,
    "errors": 0
  },
  "screenshots": [".gamestudio/evidence/F002/shot_01.png"],
  "findings": [
    {
      "severity": "minor",
      "title": "Merge burst covers the wave counter for about 0.3 s",
      "detail": "Burst particles at tier 2+ overlap the top HUD when the merge happens in row 0 or 1; the wave counter is unreadable during the burst.",
      "repro": "seed 1, step 4"
    },
    {
      "severity": "polish",
      "title": "Second tutorial spawn lands in the bottom row under the thumb",
      "detail": "Forced tutorial spawns should prefer the middle rows so the merge drag is fully visible.",
      "repro": ["seed 1", "step 3"]
    }
  ],
  "verdict": "pass",
  "notes": "t is simulated seconds (60 ticks per second) in a headless run. Tutorial level w1_l001 forces two Flint spawns so the first merge is guaranteed. Step 5 drops the golem on an empty cell, which must be rejected (no repositioning)."
}
